{
  "$schema": "http://json-schema.org/schema#",
  "type": "object",
  "properties": {
    "awesome_names": {
      "type": "array",
      "items": {
        "type": "object",
        "properties": {
          "awesome_name": {
            "type": "string"
          },
          "language": {
            "type": "object",
            "properties": {
              "name": {
                "type": "string"
              },
              "url": {
                "type": "string"
              }
            },
            "required": [
              "name",
              "url"
            ]
          }
        },
        "required": [
          "awesome_name",
          "language"
        ]
      }
    },
    "id": {
      "type": "integer"
    },
    "name": {
      "type": "string"
    },
    "names": {
      "type": "array",
      "items": {
        "type": "object",
        "properties": {
          "language": {
            "type": "object",
            "properties": {
              "name": {
                "type": "string"
              },
              "url": {
                "type": "string"
              }
            },
            "required": [
              "name",
              "url"
            ]
          },
          "name": {
            "type": "string"
          }
        },
        "required": [
          "language",
          "name"
        ]
      }
    },
    "pokemon_species": {
      "type": "array",
      "items": {
        "type": "object",
        "properties": {
          "name": {
            "type": "string"
          },
          "url": {
            "type": "string"
          }
        },
        "required": [
          "name",
          "url"
        ]
      }
    }
  },
  "required": [
    "awesome_names",
    "id",
    "name",
    "names",
    "pokemon_species"
  ]
}
