{
    "awesome_names": [
        {
            "awesome_name": "L\u00e9pidopt\u00e8re",
            "language": {
                "name": "fr",
                "url": "https://pokeapi.co/api/v2/language/5/"
            }
        },
        {
            "awesome_name": "Lepidopterous",
            "language": {
                "name": "en",
                "url": "https://pokeapi.co/api/v2/language/9/"
            }
        }
    ],
    "id": 13,
    "name": "bug-wings",
    "names": [
        {
            "language": {
                "name": "fr",
                "url": "https://pokeapi.co/api/v2/language/5/"
            },
            "name": "Ailes d'insecte"
        },
        {
            "language": {
                "name": "en",
                "url": "https://pokeapi.co/api/v2/language/9/"
            },
            "name": "Bug wings"
        }
    ],
    "pokemon_species": [
        {
            "name": "butterfree",
            "url": "https://pokeapi.co/api/v2/pokemon-species/12/"
        },
        {
            "name": "beedrill",
            "url": "https://pokeapi.co/api/v2/pokemon-species/15/"
        },
        {
            "name": "venomoth",
            "url": "https://pokeapi.co/api/v2/pokemon-species/49/"
        },
        {
            "name": "scyther",
            "url": "https://pokeapi.co/api/v2/pokemon-species/123/"
        },
        {
            "name": "yanma",
            "url": "https://pokeapi.co/api/v2/pokemon-species/193/"
        },
        {
            "name": "crobat",
            "url": "https://pokeapi.co/api/v2/pokemon-species/169/"
        },
        {
            "name": "scizor",
            "url": "https://pokeapi.co/api/v2/pokemon-species/212/"
        },
        {
            "name": "beautifly",
            "url": "https://pokeapi.co/api/v2/pokemon-species/267/"
        },
        {
            "name": "dustox",
            "url": "https://pokeapi.co/api/v2/pokemon-species/269/"
        },
        {
            "name": "masquerain",
            "url": "https://pokeapi.co/api/v2/pokemon-species/284/"
        },
        {
            "name": "ninjask",
            "url": "https://pokeapi.co/api/v2/pokemon-species/291/"
        },
        {
            "name": "vibrava",
            "url": "https://pokeapi.co/api/v2/pokemon-species/329/"
        },
        {
            "name": "kricketune",
            "url": "https://pokeapi.co/api/v2/pokemon-species/402/"
        },
        {
            "name": "mothim",
            "url": "https://pokeapi.co/api/v2/pokemon-species/414/"
        },
        {
            "name": "vespiquen",
            "url": "https://pokeapi.co/api/v2/pokemon-species/416/"
        },
        {
            "name": "yanmega",
            "url": "https://pokeapi.co/api/v2/pokemon-species/469/"
        },
        {
            "name": "volcarona",
            "url": "https://pokeapi.co/api/v2/pokemon-species/637/"
        },
        {
            "name": "ribombee",
            "url": "https://pokeapi.co/api/v2/pokemon-species/743/"
        },
        {
            "name": "vivillon",
            "url": "https://pokeapi.co/api/v2/pokemon-species/666/"
        },
        {
            "name": "frosmoth",
            "url": "https://pokeapi.co/api/v2/pokemon-species/873/"
        }
    ]
}