{
    "awesome_names": [
        {
            "awesome_name": "Crural",
            "language": {
                "name": "fr",
                "url": "https://pokeapi.co/api/v2/language/5/"
            }
        },
        {
            "awesome_name": "Crural",
            "language": {
                "name": "en",
                "url": "https://pokeapi.co/api/v2/language/9/"
            }
        }
    ],
    "id": 7,
    "name": "legs",
    "names": [
        {
            "language": {
                "name": "fr",
                "url": "https://pokeapi.co/api/v2/language/5/"
            },
            "name": "Jambes"
        },
        {
            "language": {
                "name": "en",
                "url": "https://pokeapi.co/api/v2/language/9/"
            },
            "name": "Legs"
        }
    ],
    "pokemon_species": [
        {
            "name": "oddish",
            "url": "https://pokeapi.co/api/v2/pokemon-species/43/"
        },
        {
            "name": "poliwag",
            "url": "https://pokeapi.co/api/v2/pokemon-species/60/"
        },
        {
            "name": "doduo",
            "url": "https://pokeapi.co/api/v2/pokemon-species/84/"
        },
        {
            "name": "tangela",
            "url": "https://pokeapi.co/api/v2/pokemon-species/114/"
        },
        {
            "name": "porygon",
            "url": "https://pokeapi.co/api/v2/pokemon-species/137/"
        },
        {
            "name": "dodrio",
            "url": "https://pokeapi.co/api/v2/pokemon-species/85/"
        },
        {
            "name": "exeggutor",
            "url": "https://pokeapi.co/api/v2/pokemon-species/103/"
        },
        {
            "name": "wooper",
            "url": "https://pokeapi.co/api/v2/pokemon-species/194/"
        },
        {
            "name": "torchic",
            "url": "https://pokeapi.co/api/v2/pokemon-species/255/"
        },
        {
            "name": "seedot",
            "url": "https://pokeapi.co/api/v2/pokemon-species/273/"
        },
        {
            "name": "shroomish",
            "url": "https://pokeapi.co/api/v2/pokemon-species/285/"
        },
        {
            "name": "azurill",
            "url": "https://pokeapi.co/api/v2/pokemon-species/298/"
        },
        {
            "name": "porygon2",
            "url": "https://pokeapi.co/api/v2/pokemon-species/233/"
        },
        {
            "name": "bonsly",
            "url": "https://pokeapi.co/api/v2/pokemon-species/438/"
        },
        {
            "name": "cherrim",
            "url": "https://pokeapi.co/api/v2/pokemon-species/421/"
        },
        {
            "name": "roggenrola",
            "url": "https://pokeapi.co/api/v2/pokemon-species/524/"
        },
        {
            "name": "swirlix",
            "url": "https://pokeapi.co/api/v2/pokemon-species/684/"
        },
        {
            "name": "dewpider",
            "url": "https://pokeapi.co/api/v2/pokemon-species/751/"
        },
        {
            "name": "bounsweet",
            "url": "https://pokeapi.co/api/v2/pokemon-species/761/"
        },
        {
            "name": "carkol",
            "url": "https://pokeapi.co/api/v2/pokemon-species/838/"
        },
        {
            "name": "hatenna",
            "url": "https://pokeapi.co/api/v2/pokemon-species/856/"
        },
        {
            "name": "stonjourner",
            "url": "https://pokeapi.co/api/v2/pokemon-species/874/"
        },
        {
            "name": "dracovish",
            "url": "https://pokeapi.co/api/v2/pokemon-species/882/"
        }
    ]
}